{
  "id": "strategy-rating",
  "type": "strategy_rating",
  "title": {"en": "Strategy rating", "tr": "Strateji değerlendirmesi"},
  "fields": [
    {"id": "strategy", "kind": "text", "label": {"en": "Which strategy did you try", "tr": "Hangi stratejiyi denediniz"}},
    {"id": "usefulness", "kind": "scale_0_100", "label": {"en": "How useful was it (0-100)", "tr": "Ne kadar yararlıydı (0-100)"}},
    {"id": "why", "kind": "textarea", "label": {"en": "What made it work or not", "tr": "İşe yaramasını ya da yaramamasını ne sağladı"}}
  ]
}
