{
  "id": "symptom-checklist",
  "type": "symptom_checklist",
  "title": {"en": "Weekly symptom check", "tr": "Haftalık belirti kontrolü"},
  "fields": [
    {"id": "s1", "kind": "scale_0_3", "label": {"en": "Careless mistakes in detail-heavy work", "tr": "Detay gerektiren işlerde dikkatsiz hatalar"}},
    {"id": "s2", "kind": "scale_0_3", "label": {"en": "Difficulty sustaining attention in tasks", "tr": "Görevlerde dikkati sürdürmekte zorluk"}},
    {"id": "s3", "kind": "scale_0_3", "label": {"en": "Not seeming to listen when spoken to directly", "tr": "Doğrudan konuşulduğunda dinlemiyor gibi görünme"}},
    {"id": "s4", "kind": "scale_0_3", "label": {"en": "Not following through on instructions or finishing chores", "tr": "Yönergeleri sonlandırmama veya işleri bitirmeme"}},
    {"id": "s5", "kind": "scale_0_3", "label": {"en": "Trouble organizing tasks and activities", "tr": "Görev ve etkinlikleri düzenlemede güçlük"}},
    {"id": "s6", "kind": "scale_0_3", "label": {"en": "Avoiding or delaying tasks that need sustained mental effort", "tr": "Sürekli zihinsel çaba gerektiren görevlerden kaçınma veya erteleme"}},
    {"id": "s7", "kind": "scale_0_3", "label": {"en": "Losing things needed for daily life", "tr": "Günlük yaşam için gereken eşyaları kaybetme"}},
    {"id": "s8", "kind": "scale_0_3", "label": {"en": "Easily distracted by unrelated stimuli", "tr": "İlgisiz uyaranlarla kolayca dikkatin dağılması"}},
    {"id": "s9", "kind": "scale_0_3", "label": {"en": "Forgetful in daily activities", "tr": "Günlük etkinliklerde unutkanlık"}},
    {"id": "s10", "kind": "scale_0_3", "label": {"en": "Fidgeting or restlessness with hands or feet", "tr": "El veya ayaklarla kıpırdanma ya da huzursuzluk"}},
    {"id": "s11", "kind": "scale_0_3", "label": {"en": "Leaving seat when staying seated is expected", "tr": "Oturulması beklenen yerde yerinden kalkma"}},
    {"id": "s12", "kind": "scale_0_3", "label": {"en": "Running about or feeling driven to move in situations where it is inappropriate", "tr": "Uygunsuz ortamlarda koşuşturma ya da hareket etme dürtüsü hissetme"}},
    {"id": "s13", "kind": "scale_0_3", "label": {"en": "Difficulty doing things quietly or at a relaxed pace", "tr": "Sessizce veya rahat bir tempoda yapmakta zorluk"}},
    {"id": "s14", "kind": "scale_0_3", "label": {"en": "Feeling 'on the go' or unable to slow down", "tr": "'Sürekli hareket halinde' hissetme veya yavaşlayamama"}},
    {"id": "s15", "kind": "scale_0_3", "label": {"en": "Talking excessively", "tr": "Aşırı konuşma"}},
    {"id": "s16", "kind": "scale_0_3", "label": {"en": "Blurting out answers before a question is finished", "tr": "Soru bitmeden cevabı ağzından kaçırma"}},
    {"id": "s17", "kind": "scale_0_3", "label": {"en": "Trouble waiting for a turn", "tr": "Sıra beklemekte güçlük"}},
    {"id": "s18", "kind": "scale_0_3", "label": {"en": "Interrupting or intruding on others", "tr": "Başkalarının sözünü kesme veya araya girme"}},
    {"id": "total", "kind": "scale_0_3", "label": {"en": "Overall impact on my week", "tr": "Haftam üzerindeki genel etki"}}
  ]
}
